{"clock":"monotonic","contractId":"reveal-plan","contradictionThreshold":{"changedOccurrenceFraction":0.25,"firstRevealOrdinal":4},"instanceId":"revision-amber","intervalMs":120000,"schemaVersion":1,"slots":[{"chapterIndex":10,"cipherChapterArtifact":{"artifactType":"cipher-chapter","byteLength":38271,"sha256":"974974d011951d33d78e7d623e51036ffc2fdfb6f5516d5ebc7f53559e78c8cb"},"cumulativeChangedContradictionMass":0,"cumulativeTokenCount":4394,"ordinal":1,"plannedOffsetMs":0,"tokenCount":4394},{"chapterIndex":11,"cipherChapterArtifact":{"artifactType":"cipher-chapter","byteLength":31624,"sha256":"a1b881bbe020730182ca02fcccf26b7ff84c5b7a5aff2313254b3c27d790f214"},"cumulativeChangedContradictionMass":0,"cumulativeTokenCount":8021,"ordinal":2,"plannedOffsetMs":120000,"tokenCount":3627},{"chapterIndex":12,"cipherChapterArtifact":{"artifactType":"cipher-chapter","byteLength":58165,"sha256":"82985a5498f122d3973036b1455219173e1aaaa72f01cd44c260afb8a20168e8"},"cumulativeChangedContradictionMass":0,"cumulativeTokenCount":14645,"ordinal":3,"plannedOffsetMs":240000,"tokenCount":6624},{"chapterIndex":13,"cipherChapterArtifact":{"artifactType":"cipher-chapter","byteLength":31865,"sha256":"150f6b546258c71e7767ce5ba7c6aa2eeb43bae604c978107009378250ba47f5"},"cumulativeChangedContradictionMass":0.27631578947368424,"cumulativeTokenCount":18403,"ordinal":4,"plannedOffsetMs":360000,"tokenCount":3758},{"chapterIndex":14,"cipherChapterArtifact":{"artifactType":"cipher-chapter","byteLength":30458,"sha256":"89827cbf8779adb6ad5f5c1c457a295c22dffd3874b350f01d8f237c7b094f02"},"cumulativeChangedContradictionMass":0.5717703349282297,"cumulativeTokenCount":21964,"ordinal":5,"plannedOffsetMs":480000,"tokenCount":3561},{"chapterIndex":15,"cipherChapterArtifact":{"artifactType":"cipher-chapter","byteLength":48676,"sha256":"6157832003d9c3df524bdcc414ed2205af38619b297ce671767a8d9b14bf1023"},"cumulativeChangedContradictionMass":1,"cumulativeTokenCount":27504,"ordinal":6,"plannedOffsetMs":600000,"tokenCount":5540}]}